{
  "id": "25c176b6-b200-4575-9217-e23c6105163c",
  "cnpj": "99999999999999",
  "address": {
    "zipCode": "00000000",
    "street": "Quadra 32",
    "number": "16",
    "neighborhood": "Gama",
    "city": "SAO PAULO",
    "state": "DF",
    "additionalInfo": ""
  },
  "email": "financeiro@empresa.com.br",
  "phones": [
    {
      "areaCode": "00",
      "number": "000000000"
    },
    {
      "areaCode": "00",
      "number": "000000000"
    }
  ],
  "externalId": "617693136",
  "credentials": {
    "appKey": "the_app_key",
    "appSecret": "the_app_secret"
  },
  "municipalRegistration": "2222222222222",
  "cnae": {
    "code": "8599604",
    "description": "Treinamento em desenvolvimento profissional e gerencial"
  },
  "name": "EMPRESA FICTICIA LTDA",
  "nickName": "EMPRESA FICTICIA",
  "stateRegistration": "2222222222222",
  "isActive": true,
  "createdAt": "2021-11-05T15:05:38.233Z",
  "updatedAt": "2021-11-05T15:29:58.455Z"
}